{
  "origin": "automatic-assurance-test-synthesis",
  "profile_version": "ASCP-0.2",
  "program_id": "AIR-PROG-FAF49B35395C",
  "scenarios": [
    {
      "cycles": [
        {
          "blocking_runtime_fault": false,
          "expected": {
            "committed_state": {
              "LinkFaultLatched": false,
              "State": "NOMINAL"
            },
            "normal_commit_inhibited": false,
            "outputs": {
              "BlockingLinkFault": false,
              "CommandPermit": true,
              "DegradedLinkIndication": false,
              "LostLinkProcedureRequest": false,
              "MissionProgressionPermit": true,
              "ReturnToHomeRequest": false,
              "SupervisorState": "NOMINAL",
              "UsePrimaryLink": true,
              "UseSecondaryLink": false
            }
          },
          "inputs": {
            "CommandChannelAuthenticated": true,
            "InitializationComplete": true,
            "InputSetValid": true,
            "LinkLossPersisted": false,
            "LinkQualityDegraded": false,
            "PrimaryLinkAvailable": false,
            "RecoveryStable": false,
            "ResetAuthorized": false,
            "SecondaryLinkAvailable": true
          },
          "obligation_hits": [
            "OBL-CASE-AIR-CASEARM-C303ECB4F360",
            "OBL-CASE-AIR-CASEARM-CAEFC1E115B8",
            "OBL-COND-AIR-COND-1144A3531C95-FALSE",
            "OBL-COND-AIR-COND-28DB73F26FB0-FALSE",
            "OBL-COND-AIR-COND-64F15C3C5A02-FALSE",
            "OBL-COND-AIR-COND-71AF59F91436-TRUE",
            "OBL-COND-AIR-COND-7CE862BD5FCD-TRUE",
            "OBL-COND-AIR-COND-7E9750C7D61B-TRUE",
            "OBL-COND-AIR-COND-944024658FE0-FALSE",
            "OBL-COND-AIR-COND-BED7779F4424-TRUE",
            "OBL-DEC-AIR-DEC-03AE84856B0F-FALSE",
            "OBL-DEC-AIR-DEC-7E345C4AF44F-FALSE",
            "OBL-DEC-AIR-DEC-BF704A123803-TRUE",
            "OBL-DEC-AIR-DEC-E11528F772D0-TRUE",
            "OBL-REQ-LINK-HLR-001",
            "OBL-REQ-LINK-HLR-002",
            "OBL-REQ-LINK-HLR-005",
            "OBL-REQ-LINK-HLR-006",
            "OBL-REQ-LINK-HLR-011",
            "OBL-REQ-LINK-HLR-012",
            "OBL-REQ-LINK-HLR-013",
            "OBL-REQ-LINK-HLR-014",
            "OBL-STMT-AIR-STMT-029FD17D66EA",
            "OBL-STMT-AIR-STMT-0BD1DE8869A3",
            "OBL-STMT-AIR-STMT-14393895584B",
            "OBL-STMT-AIR-STMT-39F8E8639950",
            "OBL-STMT-AIR-STMT-3C3A46196002",
            "OBL-STMT-AIR-STMT-48AD42CC4969",
            "OBL-STMT-AIR-STMT-52D3D83A6B1A",
            "OBL-STMT-AIR-STMT-63250DD6E3B2",
            "OBL-STMT-AIR-STMT-6501D1DD4935",
            "OBL-STMT-AIR-STMT-7FE4FD402DDD",
            "OBL-STMT-AIR-STMT-8747F897C058",
            "OBL-STMT-AIR-STMT-88790EE5C92A",
            "OBL-STMT-AIR-STMT-88B97ACB290A",
            "OBL-STMT-AIR-STMT-8C6ADF7B028D",
            "OBL-STMT-AIR-STMT-9351A2ED74F5",
            "OBL-STMT-AIR-STMT-94A658201069",
            "OBL-STMT-AIR-STMT-AC5A8184A44E",
            "OBL-STMT-AIR-STMT-D794F39C615E",
            "OBL-STMT-AIR-STMT-E1EB5BEBC18A",
            "OBL-STMT-AIR-STMT-E339B90EFC08"
          ]
        },
        {
          "blocking_runtime_fault": false,
          "expected": {
            "committed_state": {
              "LinkFaultLatched": true,
              "State": "LOST_LINK"
            },
            "normal_commit_inhibited": false,
            "outputs": {
              "BlockingLinkFault": true,
              "CommandPermit": false,
              "DegradedLinkIndication": true,
              "LostLinkProcedureRequest": true,
              "MissionProgressionPermit": false,
              "ReturnToHomeRequest": true,
              "SupervisorState": "LOST_LINK",
              "UsePrimaryLink": false,
              "UseSecondaryLink": false
            }
          },
          "inputs": {
            "CommandChannelAuthenticated": false,
            "InitializationComplete": false,
            "InputSetValid": true,
            "LinkLossPersisted": false,
            "LinkQualityDegraded": false,
            "PrimaryLinkAvailable": false,
            "RecoveryStable": false,
            "ResetAuthorized": false,
            "SecondaryLinkAvailable": false
          },
          "obligation_hits": [
            "OBL-CASE-AIR-CASEARM-A57D1D16839D",
            "OBL-CASE-AIR-CASEARM-AA72EE6244F5",
            "OBL-COND-AIR-COND-1144A3531C95-TRUE",
            "OBL-COND-AIR-COND-28DB73F26FB0-FALSE",
            "OBL-COND-AIR-COND-4089AB0D6750-FALSE",
            "OBL-COND-AIR-COND-71AF59F91436-TRUE",
            "OBL-COND-AIR-COND-7320AD49DCC7-TRUE",
            "OBL-COND-AIR-COND-793843FC2D65-TRUE",
            "OBL-COND-AIR-COND-944024658FE0-FALSE",
            "OBL-DEC-AIR-DEC-03AE84856B0F-TRUE",
            "OBL-DEC-AIR-DEC-7E345C4AF44F-FALSE",
            "OBL-DEC-AIR-DEC-BF704A123803-TRUE",
            "OBL-DEC-AIR-DEC-F15FB827C5C1-TRUE",
            "OBL-REQ-LINK-HLR-005",
            "OBL-REQ-LINK-HLR-007",
            "OBL-REQ-LINK-HLR-011",
            "OBL-REQ-LINK-HLR-012",
            "OBL-REQ-LINK-HLR-013",
            "OBL-REQ-LINK-HLR-014",
            "OBL-STMT-AIR-STMT-029FD17D66EA",
            "OBL-STMT-AIR-STMT-0BD1DE8869A3",
            "OBL-STMT-AIR-STMT-14393895584B",
            "OBL-STMT-AIR-STMT-1A656E3E8CF7",
            "OBL-STMT-AIR-STMT-1D79B159A9EB",
            "OBL-STMT-AIR-STMT-39F8E8639950",
            "OBL-STMT-AIR-STMT-3A8D9B1590D7",
            "OBL-STMT-AIR-STMT-48AD42CC4969",
            "OBL-STMT-AIR-STMT-52D3D83A6B1A",
            "OBL-STMT-AIR-STMT-63250DD6E3B2",
            "OBL-STMT-AIR-STMT-6501D1DD4935",
            "OBL-STMT-AIR-STMT-767D388028B1",
            "OBL-STMT-AIR-STMT-7FE4FD402DDD",
            "OBL-STMT-AIR-STMT-88790EE5C92A",
            "OBL-STMT-AIR-STMT-88B97ACB290A",
            "OBL-STMT-AIR-STMT-8C6ADF7B028D",
            "OBL-STMT-AIR-STMT-99435E75414B",
            "OBL-STMT-AIR-STMT-AC5A8184A44E",
            "OBL-STMT-AIR-STMT-C9E2D8A022F0",
            "OBL-STMT-AIR-STMT-E339B90EFC08"
          ]
        },
        {
          "blocking_runtime_fault": false,
          "expected": {
            "committed_state": {
              "LinkFaultLatched": true,
              "State": "RECOVERY_PENDING"
            },
            "normal_commit_inhibited": false,
            "outputs": {
              "BlockingLinkFault": true,
              "CommandPermit": false,
              "DegradedLinkIndication": true,
              "LostLinkProcedureRequest": false,
              "MissionProgressionPermit": false,
              "ReturnToHomeRequest": false,
              "SupervisorState": "RECOVERY_PENDING",
              "UsePrimaryLink": false,
              "UseSecondaryLink": false
            }
          },
          "inputs": {
            "CommandChannelAuthenticated": true,
            "InitializationComplete": false,
            "InputSetValid": true,
            "LinkLossPersisted": false,
            "LinkQualityDegraded": false,
            "PrimaryLinkAvailable": false,
            "RecoveryStable": true,
            "ResetAuthorized": false,
            "SecondaryLinkAvailable": true
          },
          "obligation_hits": [
            "OBL-CASE-AIR-CASEARM-4DE54E35330D",
            "OBL-CASE-AIR-CASEARM-A6A75BD70C12",
            "OBL-COND-AIR-COND-07D709DB7F51-FALSE",
            "OBL-COND-AIR-COND-1144A3531C95-FALSE",
            "OBL-COND-AIR-COND-198A1B1EE4CF-TRUE",
            "OBL-COND-AIR-COND-28DB73F26FB0-FALSE",
            "OBL-COND-AIR-COND-71AF59F91436-TRUE",
            "OBL-COND-AIR-COND-944024658FE0-FALSE",
            "OBL-COND-AIR-COND-B72FED13362D-TRUE",
            "OBL-COND-AIR-COND-B856C7AB9AF6-TRUE",
            "OBL-DEC-AIR-DEC-03AE84856B0F-FALSE",
            "OBL-DEC-AIR-DEC-7E345C4AF44F-FALSE",
            "OBL-DEC-AIR-DEC-BF704A123803-TRUE",
            "OBL-DEC-AIR-DEC-C4B7B27E0075-TRUE",
            "OBL-RECOVERY-LINK-RECOVERY-LOST-LINK",
            "OBL-REQ-LINK-HLR-005",
            "OBL-REQ-LINK-HLR-008",
            "OBL-REQ-LINK-HLR-009",
            "OBL-REQ-LINK-HLR-011",
            "OBL-REQ-LINK-HLR-012",
            "OBL-REQ-LINK-HLR-013",
            "OBL-REQ-LINK-HLR-014",
            "OBL-STMT-AIR-STMT-029FD17D66EA",
            "OBL-STMT-AIR-STMT-082E6D18F5E4",
            "OBL-STMT-AIR-STMT-0BD1DE8869A3",
            "OBL-STMT-AIR-STMT-14393895584B",
            "OBL-STMT-AIR-STMT-39F8E8639950",
            "OBL-STMT-AIR-STMT-485408464A38",
            "OBL-STMT-AIR-STMT-48AD42CC4969",
            "OBL-STMT-AIR-STMT-52D3D83A6B1A",
            "OBL-STMT-AIR-STMT-63250DD6E3B2",
            "OBL-STMT-AIR-STMT-6501D1DD4935",
            "OBL-STMT-AIR-STMT-7FE4FD402DDD",
            "OBL-STMT-AIR-STMT-88790EE5C92A",
            "OBL-STMT-AIR-STMT-88B97ACB290A",
            "OBL-STMT-AIR-STMT-8C6ADF7B028D",
            "OBL-STMT-AIR-STMT-94E7C31BC9A9",
            "OBL-STMT-AIR-STMT-AC5A8184A44E",
            "OBL-STMT-AIR-STMT-E339B90EFC08",
            "OBL-STMT-AIR-STMT-EAED9383D904"
          ]
        }
      ],
      "id": "SYN-0356A8F55DA3",
      "initial_state": {
        "LinkFaultLatched": false,
        "State": "INITIALIZING"
      },
      "requirements": [
        "LINK-HLR-008",
        "LINK-HLR-009"
      ],
      "target_obligations": [
        "OBL-STMT-AIR-STMT-EAED9383D904"
      ]
    },
    {
      "cycles": [
        {
          "blocking_runtime_fault": false,
          "expected": {
            "committed_state": {
              "LinkFaultLatched": false,
              "State": "NOMINAL"
            },
            "normal_commit_inhibited": false,
            "outputs": {
              "BlockingLinkFault": false,
              "CommandPermit": true,
              "DegradedLinkIndication": false,
              "LostLinkProcedureRequest": false,
              "MissionProgressionPermit": true,